{
  "opportunity_id": "O-DEMO-001",
  "version": 1,
  "state": "VALIDATING",
  "decision_question": "Should product teams adopt a governed business-readiness gate before coding agents begin MVP implementation?",
  "decision_owner": "human:product-lead",
  "decision_at": "2026-07-21T16:00:00Z",
  "initiating_context": "Teams can generate code faster than they can determine whether a proposed product is worth building.",
  "target_user": {
    "segment": "Product and innovation team leads",
    "description": "Leaders coordinating business discovery with coding-agent execution.",
    "usage_context": "Before committing an agentic engineering budget to an MVP."
  },
  "economic_buyer": {
    "same_as_target_user": true,
    "description": "Product or innovation leader accountable for delivery budget.",
    "value_recipient": "The team avoids low-value builds and gets an auditable handoff into implementation."
  },
  "job_to_be_done": "Decide whether an MVP is the cheapest sufficient experiment and bound what a coding agent may implement.",
  "observed_problem": "Business evidence, product scope, and implementation authority are usually scattered across chat, documents, and CI.",
  "current_alternatives": [
    "Unstructured approval in chat",
    "A static product requirements document",
    "Allowing the coding agent to infer permission"
  ],
  "expected_value": "Fewer premature builds, faster review, and a reproducible audit trail from evidence to bounded action.",
  "strategic_context": "Agentic development makes decision quality and authorization clarity a first-order productivity constraint.",
  "constraints": [
    {
      "constraint_id": "C-DEMO-001",
      "type": "security",
      "description": "The judge path must run without credentials or network access."
    }
  ],
  "created_at": "2026-07-17T12:00:00Z",
  "updated_at": "2026-07-17T12:00:00Z"
}
